{
  "schema": "market-status-whatsapp.v1",
  "event_id": "0252c421-43ab-5c98-9f00-eb701dcdedf9",
  "event_type": "market.close.snapshot.v1",
  "environment": "MARKET_INTELLIGENCE",
  "trade_date": "2026-08-11",
  "generated_at": "2026-08-11T17:01:02.046143Z",
  "data_as_of": "2026-08-11T03:46:05Z",
  "timezone": "Asia/Kolkata",
  "dedupe_key": "sample:close:2026-08-11",
  "correlation_id": "4e8e055e-5ae6-4c68-820e-9a64ec522202",
  "source": {
    "provider": "canonical-test-fixture",
    "mode": "DATABASE"
  },
  "quality": {
    "status": "VALID",
    "coverage_count": 1,
    "expected_count": 1,
    "max_age_seconds": 10
  },
  "payload": {
    "index_symbol": "NIFTY50",
    "final_close": "25100",
    "previous_close": "25000",
    "daily_delta_points": "100",
    "daily_delta_percentage": "0.4",
    "session_open": "25050",
    "open_to_close_points": "50",
    "open_to_close_percentage": "0.1996007984031936",
    "session_high": "25200",
    "session_low": "24900",
    "range_points": "300",
    "range_percentage": "1.2",
    "finalisation_status": "FINAL",
    "data_as_of": "2026-08-11T03:46:05+00:00"
  }
}
