{
  "schema": "market-status-whatsapp.v1",
  "event_id": "3bd1bb5c-0cef-5a78-8d7f-729e81446431",
  "event_type": "market.oiis.candidates.changed.v1",
  "environment": "MARKET_INTELLIGENCE",
  "trade_date": "2026-08-11",
  "generated_at": "2026-08-11T17:01:02.046080Z",
  "data_as_of": "2026-08-11T03:46:05Z",
  "timezone": "Asia/Kolkata",
  "dedupe_key": "sample:oiis-both:2026-08-11",
  "correlation_id": "d6fb44ae-1a04-4f40-ad12-f16c8162d2d7",
  "source": {
    "provider": "canonical-test-fixture",
    "mode": "DATABASE"
  },
  "quality": {
    "status": "VALID",
    "coverage_count": 1,
    "expected_count": 1,
    "max_age_seconds": 10
  },
  "payload": {
    "source_run_id": "05201494-7d1e-4453-8d51-f51344cd8cbc",
    "source_run_slot": "RUN_1030",
    "source_run_completed_at": "2026-08-11T03:46:05+00:00",
    "scoring_rule_version": "OIIS:2.0",
    "trade_date": "2026-08-11",
    "long_candidates": [
      {
        "rank": 1,
        "symbol": "AAA",
        "direction": "LONG",
        "xfactor": "76.1",
        "ofactor": "74.8"
      }
    ],
    "short_candidates": [
      {
        "rank": 1,
        "symbol": "BBB",
        "direction": "SHORT",
        "xfactor": "76.1",
        "ofactor": "74.8"
      }
    ],
    "added_memberships": [
      "LONG:AAA",
      "SHORT:BBB"
    ],
    "removed_memberships": [],
    "first_qualifying_scan_of_day": false,
    "data_as_of": "2026-08-11T03:46:05+00:00"
  }
}
